review_id,title,year,user_review,user_suggestion
"10481,Trove,2018.0,""I really loved this game before, but that was before.The game is about completing your collection of cosmetics and being stronger and stronger,i liked the collection stuff because i'm that kind of person that like collecting stuff and cosmetics but everythingis so grindy and hard to get or completly based on luck.For being stronger you have to complete dungeon over and over and over forever that you get so much annoyed by them you just bomb your way to the boss, for to collecting gems and equipment to recycle,its easy early game but end game is a nightmare , the chance of upgrading your gem is so low you feel like you are forced to waste all your ressources to buy the most powerfull upgrader.There is also some update i didn liked at all , 2 of them :It really annoyed me when i realized that the chaos chest and a lot of other loot box will be no more tradable and all of itscontent will be no more tradable, it maked the collection stuff so much more harder and so ridiculously expensive !And then the adventure club update, i loved the content and was happy about that but i was not really happy about being demoted from my own club that i created and spend a lot of ressources and time in it, this is just unfair and broken.The lags, for some reason the game is laggy as hell , you get rollback , when you fly you get smashed to the ground because of rollback , you finally climb dungeon ? no no rollback do it again, load a world and disconnected from server, do a shadow tower boss but then you have a huge lag and when you are back half the team is dead ? just trove things.. Over time it become really iritating and this issue is in the game for so long i'm surprised the devs still did nothing about this. "",0"
"10482,Trove,2016.0,""well for me having more than 100 hours on trove... and this new update that is coming out, or is already out, it made the game more pay to win and it will be way harder for new players to get classes or stuff like that."",0"
"10483,Trove,2018.0,""Gamigo just bought Trion and now they are gonna do what they know best: milk it until it diesThe game itself was a fantastic idea, it didnt deserve those companies running it. Also it went downhill since the gem boxes updateRIP Trovef"",0"
"10484,Trove,2018.0,""I think I started playing back in December of 2015 on my old Glyph account and Trove during that time period was so much fun, after getting it now in 2018 I am disappointed. Everything in the shop costs credits now and the game is even more grindy than before."",0"
"10485,Trove,2015.0,""This is an edited review so bear that in mind. Trove was a fun game for me, before the Mantle of Power update, I enjoyed it heavily because of the new stuff that it offered and the goal of getting radiant gear. It offered a gallery of item cosmetics designed by others that I enjoyed experimenting with to make each of the 12 or so classes I had unique. Doing the shadow towers was also a fun experience for a time. Clubs were also a large part of why I stayed as it allowed to meet other players to converse and help one another as well as to build in a sandbox world unique to that club. Crafting mounts and pets was very fun as well - I loved the variety.However, these things only last a certain while. Over time I realised that this game was nothing but grinding. You would complete a dungeon out in the world in less than a minute to move on to the next one, and so on and so forth. Rinse and repeat 200 times a day. I didn't mind the grinding part because it was removed in a sense by the time the marketplace came out where I could earn my fortune by buying and selling items on the market place for money to buy better gear and I could live with that. Then, Mantle of Power. It's what turned this game into a grind fest. There's no avoiding it other than spending a large amount of money on gem boxes to increase your odds of ranking up gems. Gems, by the way, can only be earned from boxes that you get from a dungeon. They offer three varients of"
"10486,Trove,2016.0,""Challenged to write this review by Jason of the Baxter. 11/05/2016. 02:48 PM on a Saturday rainy evening. Myâ™¥â™¥â™¥â™¥â™¥â™¥is big but i have to write this review before switching on the good old porntube. There is many things you can say about this game... Some say it is Da Vinci's own masterpiece that has never been discovered until the recent years of Trove. Some say it is Jesus Christ himself but no, it is Trove. This game will grip you harder then a asianâ™¥â™¥â™¥â™¥â™¥â™¥at a cheap club after taking too many MDMA pills. The graphics are revolutionary and the game is just breathtaking. I cannot recommend it more then i recommend voting for Trump. 10/10 goodsirs 10/10."",1"
"10487,Trove,2015.0,""Trove is a blocky MMO which is MASSIVELY Multiplayer. It's so fun. You can raid dungeons, claim cornerstones (houses), your noble steed, and even different catagories. I've got EPIC! (Coz im EpicFaceLol) If you like massively multiplayer, open world, blocky MMO's, this is the game for you!"",1"
"10488,Trove,2018.0,""Been playing this game for a long time. not in Steam, on trion launcher. and I can tell that this game is so good. But after its release, the game changed really much. It was a good game, but this """"pay2win"""" thing finally reached this game. Thanks devs, its all about money, isn't it ?Welcome to grinding simulator 2018 everyone, in this game, you pay all of your money to the devs to get actually good, or spend hundreds of hours just killing thousands of enemies and completing hundreds of dungeons around the world with dumb puzzles in it, which you don't even need to complete them just dig the block under you until you reach the boss or if its above just use your multiplied jump boost to get all the way up.The game is really fun,but only if you want to goof around with your friends or if you'd like to just chat and get to know some random players around the world, this game's for you. Which I'm actually doing this, chatting with random people while playing the game and grinding.The grinding is really bad, boring and makes you mad, I know that myself. But If you manage to find a way to grind this game without getting bored, it can actually work out. Like, you can actually have fun in this game. I actually don't play this game anymore since the game is completely dumb right now, but you can try it out.Also there is """"Test Servers"""" for experienced players to try out upcoming things in the future, in these servers I believe you have unlimited access to everything, you have unlimited money, you can spawn things, you can get any kind of item for free on store and so on. But there is a Queue or some kind of thing for this server for a reason, I don't know why they did this, but one day I tried to join the server, I was the 12th person in queue. I left it open for several hours, around 6-7 and nothing happened. I was finally down to 6, then for a reason i kept getting up to 8 or 9. Finally i was 2th person, then 1st and poof. That was it. It just got stuck on 1st, i thought its having connection problems or some kind of a lag so i left it open again for several hours. And nothing. It still said 1st. I tried to get this server working for several times, and everytime i do this i started at as 10 or 30 in queue. And the same problem happened, maybe waited even 2 days but it kept getting stuck on 1st.I would pretty much say don't play it if you don't have any friends to play with. Because this game is hella boring when you don't have anyone with you.Overall, pay2win -7it needs grinding -3Only fun if you have friends +1Nice community (Its actually the only good thing about this game) +34/10"",0"
"10489,Trove,2018.0,""Grind is fine but this is over-repetitive grindy. Farmable rare items are hardly tradeable. They used to be tradeable and helps with the player trades. Now majority of the items are non-tradeable and locks you away with paywall. Older player might have a more leisure gameplay but for newer player I imagine it is dreadful.Building stuff is hella fun since you can pretty much build whatever. IF you love minecraft, this is probably a game for you.The MMO aspect however. :("",0"
"10490,Trove,2016.0,""It is really impressive to watch a dev team take a game and make it absolute dogâ™¥â™¥â™¥â™¥â™¥â™¥from one of the best mmos around. with all the cash grabs and untradeableâ™¥â™¥â™¥â™¥â™¥â™¥ i may as well go back to playing combat arms. atleast that way the devs dont even pretend to give a â™¥â™¥â™¥â™¥.just a little add on to this. logged on recently just to see how much of a mess this game was now... turns out, with the new club update they did at some point, they gave club ownership to the most active officer, if the leader wasnt active. or just to the most active member, if none of the officers where active. avoid this cancer at all costs, if you get attached to something, and leave the game for whatever reason, dont get shocked to find its gone next time you check.yet another addon to this. they keep rolling out """"updates"""" that, best i can tell, only serves to let them try and push new content onto the marketplace, so they can part the stupid few who still play this from more of their money."",0"
"10491,Trove,2016.0,""I played this game before it came out on steam it was fun then but now it seems there handing usâ™¥â™¥â™¥â™¥â™¥â™¥like were babys and you can't buy classes with Cubits im ok with it b/c I got all classes and I have class tokens wish they gave me for free... but I like grinding in games it makes time fly but all my classes are 15+ lv so yeah and game gets boring win you get op gear I wished it was more challenging but its to late now. Im never going to play this game anymore i'm done the end this game is going to die out just lit Also Me and a group of people got to the Moon Queen then maintenance came we were all made I felt dead inside, all the time we wasted no purple name that we all well deserved. â™¥â™¥â™¥â™¥ YOU Trove we worked SO HARD FOR THATâ™¥â™¥â™¥â™¥â™¥â™¥just to be tore away from us... all that time long gone we just got there for us the be but â™¥â™¥â™¥â™¥ed by trove. We worked so hard for that â™¥â™¥â™¥â™¥â™¥â™¥â™¥t that long ago and thats win I stoped playing the game that much as I use to until I stoped I did try to do it but all I got was people that sucked moreâ™¥â™¥â™¥â™¥â™¥â™¥then a gay bar."",0"
"10492,Trove,2017.0,""Glad to have wasted 1k hours on this game, endlessly grinding for no reason. The objective of this game is to go from dungeon to dungeon, killing enemies to gain xp and loot, such as items (weapons) or gem boxes. Doing this results in boredom and makes me want to die.There are several classes to choose from, some being OP, such as high dmg shots, or firing 500 arrows a second, and some being useless and never used. It's unbalanced but the developers don't seem to care about their game but rather how much money they can make within their updates. The updates usually happen around special events, such as Christmas or Easter ect and even if they do proper updates, fixing stuff and remaking something, they include a """"heads-start"""" pack that includes things that are either hard/impossible to get while grinding for them.Overall, the game is a piece ofâ™¥â™¥â™¥â™¥â™¥â™¥ don't spend money on it."",0"
"10493,Trove,2015.0,""To me, Trove feels like the developers got a few inspirations from Minecraft and a few inspirations from Terraria and applied this to a common MMO formula with a fair business model that is """"Play to Win"""" and """"Pay to Look Fabulous"""" with decent crafting times and a ton of other stuff. Of course you gotta work for all that you have and want to acquire but still, it is very much fair. However, Trove shall not be compared to either of the aforementioned games as Trove poses something inherently different and sets itself apart with multiple features (or the merging of features). But I am getting ahead of myself. If you want to skip the lengthy part of my review, you may skip to the pros and cons I've listed below.To get us started, what about Trove's lore and story? Well, as far as I am concerned, there is none. A goddess split the world into multiple, infinite realms for you to explore, venture into, slay dangerous foes and collect tons of loot and level up. So Trove has, in my eyes, the nessecary things to be an electronic video game providing fun and entertainment. Also, talking with a few community members revealed that most of the players aren't too concerned about the lack of lore as Trove is almost 100% about gameplay.So, let's switch to the gameplay!Trove's gameplay has multiple aspects I'm gonna pick apart one after the other. Starting off with character creation.And the character creation in Trove is very simple. Pick one out of 11 possible classes at the start of the game and choose a hair style and a race to go with it. However, hair styles and races are purely cosmetic and do neither benefit your character nor do they influence gameplay in any way whatsoever. For instance, I made a female robot Ice Sage-class character, a robotic mage based on ice with a nice, female hair style. Hair- and eye colour may also be chosen, though there are only a few select colours you may choose.As a new player, you will be most likely concerned with the following: Building, raiding dungeons for loot and XP, leveling up and customizing your character a little more. In terms of building, there are, in every world that is generated and the game throws you in, so-called cornerstones. The cornerstone system works like this: it's a plot of land that is 16x16 blocks in size that you can claim. Upon claiming, a basic starter house with basic equipment spawns. On your cornerstone, you can customize your house any way you want, building up to 150 blocks high (for tower enthusiasts like me) and the stone is the only place (apart from club worlds (clubs are the guilds in this game which have their own world that you can shape the way you want it)) where what you build gets saved and nobody can grief your stuff as it is protected on your little plot of land. And you can switch to another cornerstone, which then triggers the buildup of your house there and the wiping of your house from the previous one. In essence, you got a portable base.Then there's raiding lairs. There are 3 types of lairs, small, large and recipe lairs (the latter are used to craft furniture). Every lair features a boss (in case of the large lair it is 3 bosses) and every boss drops a chest with loot in it. Speaking loot, there are no armours in this game, only class skins. However, the game has weapons, masks and hats with unique styles based on the biome you've found them in. There are 12 biomes in total with entirely different themes and you are able to build your house around said themes if you wish to.Anyway, upon getting better weapons you might think """"Geez, I sure wish I could keep the style of my previous weapon and apply it to my current weapon!"""". Well, you can. With the loot collector you can (and kinda must) build to advance your game experience and collecting styles for the multiple items.Upon collecting styles you get valuable resources (but a lot of resources also have to be mined and acquired through drops or the gardening profession) and mastery points. The mastery rank is a different scale compared to your class's level. You have to level each class you get individually (getting you more mastery points) where as your MR (mastery rank) carries over to your whole game experience.What do you do with all the resources? Crafting and building!Trove features multiple crafting stations for multiple professions that either unlock powerful items, stylish new blocks for you to build with and reward you with mastery points upon leveling up your skill. Your MR also rewards you with stuff such as storage currency, stat upgrades that carry over to all of your classes and items.The professions involve: Ringcrafting, runecrafting, gardening, fishing and building (the latter does not award you MR points however).Other stuff includes, but is not limited to:Mounts, allies that give passive bonuses, boats to ride on the seas, sails for your boats, mag riders (another form of mount) and much more.Now, switching to the term """"variety"""". Here are some gripes I got about Trove.The enemy variety is barely present. Of course, every biome has its unique enemies and with unique looks and sounds, but the overall variety in terms of attack patterns and abilities of said enemies just isn't there much. Basically you will be fighting the same enemy over and over again with a different skin. Save for the shadow realm bosses of course (which are in more advanced worlds).Then the class abilities. Each class has four abilitites, two of which have to be unlocked with progression through levels. In my opinion, this is not enough combat variety. But I spoke with some community members and it revealed that the majority of players actually don't mind that too much as Trove's main focus isn't combat. Because to me, Trove has no main focus so to speak, as you can do a myriad of other things within the game.Another thing that got me disappointed a bit was the music. Don't get me wrong, the music in itself is fine by me. But it is almost never present. When you enter a new biome, the biome specific music plays for a minute, then stops for about half an hour and starts playing again. This is not much for such an explorative game like this I dare say.What I loved about Trove was the amount of biomes there is and the possibility to style everything, even your character, with a specific biome in mind as well as the amount of possible blocks for building your house. Another thing that I found really neat were the tooltips for almost every item as they, in the majority of cases, reveal how to acquire them. You can view all available items in the game in a certain List (default press Y and check out that stuff) and the tooltips for every item almost all of the time tell you how to get them. This is pretty neat as it reduces the amount of times I have to ask somebody or look it up in a wiki.One last thing: the devs.They punch out so many updates and server maintenance to ensure everybody gets a good gaming experience. If they notice there is a persistent issue with even a small percentage of players, they warn us beforehand and then get right to it by shutting down the servers and solving the problems. In my opinion, that's good work.But now, off to the pros and cons:Pros:- Vast world to explore with a lot of variety in landscapes- Fly, hop on a boat or ride your mount- Ability to style your equip the way you want- Ability to have your own, personal WORLD for yourself- A portable base of operations that you can customize the way you want with a variety of different blocks- Great development team so far- Fair business modelCons:- Lack in enemy variety- Lack in musical presence- Lack in class ability variety- Getting some resources might get tedious- Lack of combat varietyWould I recommend this game? I had a ton of fun with it so far, so yes. Totally.And it's free, it's not like you're paying anything so give Trove a try today!"",1"
10494,Trove,2016.0,This review will be divided in three parts:1. Is Trove for me?2. Pros and cons about Trove!3. Conclusion!Part.1:Looking for a hardcore mmorpg? âœ–Looking for a mmorpg with a great story? âœ–Looking for a mmorpg that has an immersive open world that you can explore? âœ–Looking for a PvP focused mmo? âœ–Looking for a fun mmorpg?  âœ” (Trove might be for you)Part.2: Pros: *Fun to play*Doesn't take itself to seriously*Very good building mechanics*Mod support Cons:*Pay 2 win*Can be boring*A lot of grinding*A lot of RNG in the gamePart.3: In conclusion Trove is a free to play mmorpg (Not really an mmo in my opinion) and there is fun to be had. That being said the game faces lots of issues. The game is free so you aren't sacrificing much by giving it a shot.Hopefully you found the review helpful.,0
"10495,Trove,2015.0,""After a decent amount of time, I think I can give you guys an overview of Trove. If you like my review or not, feel free to like/ dislike and comment on it.Pros:- balanced classes, even if you only have 4-5 skills to use- fun with friends for a period of time- funny and innovative dungeon design, like Candoria (Candyland) and Dragonfire Peaks (fire and dragons)- biome designed dungeons- no pay2win- A LOT of styling items- fun through the first 20-25 levels- interesting and innovative building mechanics- enhancements in weapons and armor- fighting system is very activeCons:- bag expension etc. will cost up to 50â‚¬ if you want to unlock every bag- no new expensions, just a lot of new shop items (stlye etc.)- late/never answering support- it's fun, for 2-3 weeks, it gets repetitive- no pvp at all- same biomes all the time- a lot of grinding in your professions like gardening or ring-crafting- after a while you just run through the dungeons to kill the boss- mastery level 30 and full radiant gear means you've beaten the game, there is no """"late game"""" contentAll in all, I would recommend this game to everybody who wants to have 30 hours of fun with his friends. Nothing in long-term, it ends in grinding and gets repetitive with time."",1"
10496,Trove,2018.0,iv played this game since i was 8 years old. i had to sitch accounts and i made this one. trove was a good game. now all it is is grinding. nothing changes and if you have money you can do what people takes mounths to do you can do in minutes. personaly this game was spacale to me because i played it with friend and made great memorys. i hope the devs do something about this game because i can say right now it isent realy fun,0
"10497,Trove,2017.0,""Pay2Win, business model like Clash of Clans, where if you spend more money, the faster you advance & obtain a higher advantage compared to other players that don't spend money on this game. At the moment, this game is dead. This may also be caused by the extremely long queue times when the game just came out, which has driven away many potential players but of course, that was last time... oh how the mighty has fallen."",0"
"10498,Trove,2017.0,""It used to be so fun, me and my friends would get on every day and play, to earn the old ingame cuurency used to buy classes, now you have to buy them with real money, not only that, but they added this weird new, """"mantle of power"""" sh*t that costs 50 dollars. so now its basically a full priced game at f2p quality, i would never reccomend this game to anyone, unless they made it like it once was. overall 2/10, can be fun-ish, but overall, a sh*tty pay2win game that costs too much for the quality of it. I hate you trion, you ruined my favourite game."",0"
"10499,Trove,2018.0,""So as of now, it wont let me create an account. It just broke! this is honestly â™¥â™¥â™¥â™¥â™¥â™¥â™¥â™¥. It looked like a lot of fun, and though it was free, I just couldnt make an account! It sent me to the website to create it, and I did that, and at first it seemed to work but then it showed an error sign, then my email got verified so I cant retry. this sucks."",0"
"10500,Trove,2016.0,""This game was really fun and a great place to make friends. However its hardcore P2W, i mean the grind before was alot but you could get there and i would get patron every now and again. But the grind Now Is Very Real. like seriously you have to dump a crapton of money into this game to even get anywhere now its ridiculous. i understand Trion needs to make money but for stuff thats mainly community made they want too much money. Mantle of power legit ruined this game everyone i pretty much played with stoped playing it and putting money into it. some streamers that loved this game stoped streaming it. its fun to build in this game but its really not worth playing anymore. just wish it wasn't so hardcore P2W and pretty much everything is non-tradeble now the ranking system is stupid. its just ruined to bad was a fun game to play"",0"
"10501,Trove,2016.0,""It was good until the last big update , cannot buy classes anymore , there is no reason to make portals and some of the classes are complete sh!t. The worst part is probably the crafting . No weapon crafting , only rings and â™¥â™¥â™¥â™¥ing plants , the dragon soul system is crappy since to get them you need to complete a challenge which would be ok but you can complete it way faster with certein classes and since you can't buy them you are sh!t out of luck. Don't even get me started on the fishing system , to get anything that is worth it you need to spend hours fishing. Oh and the pvp ..... unbalanced , not even worth talking about itOverall , install if you want to but you will get bored really fast . My hours were before this sh!t updates and if i knew the game would become like this i would never have wasted my time with itâ™¥â™¥â™¥â™¥â™¥â™¥ rating system : 7/20 (before updates)"",0"
10502,Trove,2016.0,This is honestly the worst hunk of junk ive messed with. after a solid ten minutes i realized that this game is so â™¥â™¥â™¥â™¥â™¥â™¥ that i think i couldn't tell the difference from a sewer and this game. this â™¥â™¥â™¥â™¥ing sucks.lol 1/10 for its lack of fun and wonky controls (at least for me),0
