review_id,title,year,user_review,user_suggestion
"10571,Trove,2016.0,""Ok,this game was my addiction for more then 1 month,I was playing this game 9Hours/24(maybe more),it was so fun,but there is a big problem,its kinda p2w,and its realy hard for new players to get used to the game,its a realy fun game with a lot of diverse classes and such,if u have money,go ahead,u can play it without spending any money,but its gonna be tough. The Trove RantPay2Win:(Its not the usual,p2w,but to get somewhere,u gotta pay 30E/$)Now,if u dont get the Essentials Pack,u are ******,that pack is Essential(<--u see what I did there?)it Gives you:-Some Cool Wings(cosmetic)-A Cool Motorcycle(cosmetic)-A Boat and A Sail(The boat has different stats,not the best ones but all boats are different in this game,the sail-cosmetic)-2 Tomes(This are Legendary tomes,can be *actived* once a week,they are just OP,one gives you 100 Clovers for gems,and its A LOT,and the other one gives you 50,maybe less I am not sure,dragon coins,used to craft dragons. The tomes are just op,u can get them in game if I u buy them from the action house with a lot of flux,flux is the in-game curency)-15 days of Patron(I will get to that later)-10 class coins(and insane amount of coins,they are used to unlock classes,u get get them by buying this pack,Trove Streams and by buying them with flux)-20,000 Cubits(-_-,for real? 20000 is just insane,a normal player has to play 40 days to get them and one that has patron about 14 days)And some other stuff,thats not important.Why did I say its not a typical pay2win?before this Essentials pack there was a pack called the Power pack,it was nah...but it was 20E/$,check what they did:*****If you previously picked up the Power Pack youâ€™ll also have the extra loot from this pack unlocked on your account automatically*****This is amazing,but u still had to pay them 20E,if u pay 30E now,u can have a good journey,if u dont,its gonna be quite hard PatronThis is what Patron gives you:*50% XP boost*+5 Jumps*It doubles your Magic Find(the More MF u have the better loot u get,its game is about Grinding,its RNG,and this Bonus MF,is just OP)*4 Chaos Chest per day*+2 Flasks*U mine faster*U craft faster*More PvP stuff*And something with gems(my bad idk what it is)Its awesome right?now how do u get this?U buy it with IRL money 7E per 15 days and 14E for 1 month or u buy it with 300k FLUX! its just too much(this price was set by players,to be able to sell it,u gotta buy it from the shop for about 20E,its a different type of Patron,a tradeble one,and then sell it,and omg 300k flux its a lot)*****And thats the p2w aspect of the game,thats the only bad thing in my opinion,and maybe too much RNG but thats fun***** Cons-p2w Pros-Fun-Classes are all different and fun-Grinding is awesome-The support for the game is amazing,the live chat is instant and its realy helful,they know how to do their job(not like Cryteks support)-Addicting-Its hard but its rewarding,when u get the gem from 20 to 21,u feel like god among us-New content is added every week-They realy care about players opinion,they make QNA streams where they give items to playersAnd this was my review,hope u liked it,EVEN IF U DONT WANT TO PUT SOME MONEY IN THIS GAME TRY IT,BUT ITS GONNA BE HARD,I DONT RECOMAND IT IF U DONT WANT TO SPEND ABOUT 30E AND 14ExMONTH.Its a realy good game but Micro Transactions Ruin it"",0"
"10572,Trove,2015.0,""Trove is a classic grinding MMO, with an option to fast-forward the grinding with real money. The game is fun, the different classes lend some diversity to an otherwise routine game. The enemies balance well with the player level, and the game is paced so as to offer the player a reward at intervals that make it fun and keep the game feeling like an adventure. One of the greatest features is the """"cornerstone""""- your own plot of ground that you can build and outfit as you see fit and move with you as you move from biome to biome. The downside is that grinding MMO's require functional servers to enjoy, and the developers can't seem to maintain a server or push a patch successfully to save their life. In the past two weeks since I began playing, with 48.5 hrs on record, there was not a day that passed  without the servers going down. Disruptions of less than an hour or 2 do not make the forum ( I think the dev's see them as common) but looking at the forum you can see that the server goes down for long periods at approximately 2 day intervals. (http://forums.trovegame.com/forumdisplay.php?21-Server-Status).Pros:Free to playfun biomes to exploreblock buildingmobile home baseCons:Servers are down regularlyEnemies and bosses lack varietyGame play is repetitive "",0"
"10573,Trove,2015.0,""Went to play for the first time, got put in a 1000+ player queue with an estimated wait time of more than 30 minutes. And then, to add insult to injury just as I got near the front the game crashed and I was back at the end. Moving on to something I can play NOW.Tip for the developers: attracting new players is key to growing your community. Putting them in a queue the first time they play will just send them someplace else. Let first time players jump the queue, and then if they like the game they'll be willing to wait the next time.Also, get more servers to meet the demand, or you'll also lose the players you already have."",0"
10574,Trove,2016.0,Product received for freeSTAP TRYIN TO TAKE MY MONEY. No really though this game was so good before it came to steam it was so much fun. you dident have to pay for every â™¥â™¥â™¥â™¥ing thing that your going to need to advance in the game. You dident have to pay for classes you could use cubits i really want that back cause i want to try other classses but im not going to pay money for them. I love this game so much i just want it to get better like how it was before the devs got greedy. devs please please stop being greedy cause damn i feel like your going to start making me pay money to be able to attacki want to recommend this game but i cant cause they have to see that we dont like whats goin on,0
"10575,Trove,2018.0,""One of the most engaging MMORPG experiences out there. You never run out of things to do, but you don't feel burdened and guilty for not being productive because everything you do is productive. You can just go around mindlessly killing andâ™¥â™¥â™¥â™¥â™¥â™¥â™¥â™¥and pillaging while enjoying some music for some hours and BANG, you have made a lot of useful stuff to use later on. Zero research, zero preparation, just go out there and kill stuff.Some positive points about the game:- The game's depth varies with your mood and it remains fun. You can play light and casual, you can work the market, you can go hard and achieve great stuff...you can play it any way and still have fun.- Graphics are pleasing, unless you really hate voxel stuff.- Sound effects and ambience have a nice retro feeling.- Market system is pretty straightforward, simple to use and efficient. Not a lot of depth though.- You don't need to be anywhere, you can do everything you need without having to visit NPC's.- Classes are very unique and fun to play.- Leveling is smooth.- You can have all classes without spending a single penny, you can switch classes as you please and the class is like a whole different character, with other equipment, and you level each class separately. Same as having several characters, but without having to log off to switch between them.- You can be very stylish. The appearance of every equipment you loot is added to your collection, and then you can make your equipment look however you like.- You can build your place (pretty much like Minecraft) within a predefined space called a Cornerstone. You can spawn your home in any cornerstone you find here and there. Why is this useful? Intead of having to visit NPC's, you build your own workshops and portals in your place and use them. Plus, you get to show your friends your unique home! - It's fun to move around. You can glide, you can ride, your can skate on rails, you can sail, you can fly around sitting on a â™¥â™¥â™¥â™¥ing majestic rocket flying golden throne!- Userbase has low toxicity (for an MMO).- Game is light, highly optimized, runs great, looks good.- Good servers, low latency and downtime.- High fantasy setting with a comic twist.- Many quests to do. None of them feels grindy and they're really useful and rewarding.- The game is grindy in a way that it's doesn't make it feel so grindy. And you can always do some other stuff and have fun.- Fantastic and very rewarding crafting system which is pretty straightforward and easy to grasp without being watered down or boring.- Fun events.- Responsive staff.- Few bugs.- No need to partner up. Just go out there. The game has a unique and seamless party system that rewards nearby players with exp and loot every time someone is killing, looting or completing a quest, and it will include a limited number among the nearest players. So just go out there, find people and smash stuff together without worrying or even knowing them, the games encourages that.- You can actually convince your normie and casual friends / family and actually enjoy it together, 'cause they won't have to understand much about the game to enjoy it. It can be fun in a superficial way, and is still fun when you get more into it and dive deep into it's systems.On the other hand, there are some negative aspects:- PVP is fun, but it's very far from being the center of attention. There are no open PVP areas in the wilds, there are no turf wars or factions, there are no big battles, there's not much reward in PVP in general. People very into PVP will probably hate it.- Everything is too damn colorful. It's a matter of taste, really.- Too many notifications.- Lacks a minimap.- Character building has little depth to it.- Not much strategy involved, the game doesn't encourage you to join a clan, organize and make a plan to get things done, like killing a boss.- BGM could use some more tracks. It's always the same track for the same kind of place.- Multiple jumping makes most dungeon designs totally pointless. They should at least remove that when you enter a dungeon, it feels like you're cheating and the feeling of accomplishment is overshadowed by the fact that you're basically jumping around mindlessly and ignoring mobs 99% of the time until you get to the dungeon's last chamber.- Sometimes the camera acts like a â™¥â™¥â™¥â™¥â™¥ when you're near walls, if you're in a small room or a narrow passage.- Battlefield is a mess. Sometimes too many mobs on one place, too many skills and explosions, always too many colors...very often you can't seeâ™¥â™¥â™¥â™¥â™¥â™¥- I feel that potions aren't the ideal approach to this game in particular. Not sure what it could be though. Maybe a new potion system, with craftable potions, recipes to collect, levels and different effects.- Dungeons very often are generated in a odd way and you loose too much time trying to find the entrance.- Classes are not balanced at all, for both PVP and PVE. Some will always stand out, while others are pretty much useless and not so fun to play.- They should add a proper dashing system so that you could move around more freely.- Not a single class can fight while mounted, even the summoners and tamers. Like wtf."",1"
"10576,Trove,2017.0,""It's a very nice game although it is Pay to Win. Players need to stop complaining and play the dam game if you don't like it too bad cuz there are plenty of players who do. All you need is to grind with a bunch of your friends to make it fun and enjoyable the worlds are nice and big. From my country ( Singapore, Asia ) the EU servers are not as laggy as the NA servers so if you are from Asia region play the EU servers it's much smoother. This game is great tons of fun. I hope the developers can improve and tweak something's but anyways it's a fun and awesome game for you, Dungeon, RPG, MMO, Voxel Players out there!"",1"
"10577,Trove,2016.0,""300+ hours pumped into this game, but now im never going to play it again unless they remove this patch that is....I really dont understand these cancerous developers they were making progress on trove making the servers better,adding tons of new content weekly and then they decide to make the game complete garbage by putting in even more P2W or pay to not grind for hours and hours maybe even days, this patch is pretty good for players that have everything but this patch is horrible for new players because you're going to have to grind for atleast a good couple hours maybe even a day or two OR you can pay money (about $10)..  "",0"
"10578,Trove,2017.0,""Sure Trove is a good game and all but.. the fun starts to die when you become,""""to OP.""""The over all concept and game is nice (at first glance) but then you notice the patron stuff, the lowered droped rates and the BUY ONLY CLASSES.it essentialy become pay to win once you get to max LV.And last but not least this isnt my final review when they kick out 2 to 3 mor updates i mightreconsider reviewing it but untill then goodbye Trove!"",0"
"10579,Trove,2016.0,""Complete cash grab,  once there were 4 classes that you could play for free with others available to pay for... with recent changes you have 1 class you can choose from and any past classes you might have leveled up were completely deleted and nothing returned.   A complete â™¥â™¥â™¥â™¥â™¥â™¥â™¥t game that is on the edge of being as â™¥â™¥â™¥â™¥â™¥â™¥ as Digital Homicide games.  Only difference is this actually works."",0"
10580,Trove,2016.0,Are you stupid? Why would you be so greedy and kill the dam game? Makes me sick. I have like 237 hours in to this game but will uninstall and will never play again. im suck of Trion you ruin every game you touch because of greed. Im not alone. I know lots of players that uninstalled cuz of this hope your happy. GREEDYhttps://youtu.be/ENYNq1MZiWshttps://youtu.be/h0Fv51-WhbQ ,0
"10581,Trove,2016.0,""Stopped playing it awhile ago for a reason - not even sure why I added it on Steam.  I had some fun with it at one point, but can't really get into it much now - seems like they added it to Steam just to increase the opportunity to grab more cash from folks with all of the packs/cosmetic stuff."",0"
"10582,Trove,2015.0,""This is one of the best MMO's I have played. The experience is unique and I would recommend it to anyone. THIS IS A LOOT HEAVY GAME!Trion consistantly update the game and are always on top of glitches and malfunctions. They keep this game playable and interesting with content being added all of the time.PROS+Light hearted, dungeon crawl +One of the smoothest playing MMORPG's around+Constant updates and server fixes+Does microtransactions right+CONS- Easy to get lost in the game (as it consumes your life)- Server downtime feel like an eternity (only because I want to get back in game)There are not any cons really. Play it, try it, love it.10/10 "",1"
"10583,Trove,2015.0,""This game is great, if you love fun dungeons with your friends. My favourite thing is the great collection of  weapons and interesting crafting. I havent played it much on this PC, but i played it on my friends PC. So I know its great :). I reccmend It."",1"
"10584,Trove,2016.0,""i downloaded the game (which took an hour) then opened it and realized i needed to make a glyph acount, i did that after 45 minutes of frusterarton, and it needed to download more data (which took another hour) then i launched it and it automaticly closed..."",0"
"10585,Trove,2016.0,""It kind of sucks now. Ya see, it used to be a nice little MMO for people who didn't want to pay much (like me). Then they made the classes things you had to buy. And they made it so if you wanted anything cool you had to either A: grind for it. B: Pay your money or C: Be really lucky. Not to mention that the combat system was never that great to begin with. There is literally only 1 upside, and that's the fact that the market is really easy to get rich off of. Basically, it used to be great but now it kind of sucks."",0"
"10586,Trove,2015.0,""I've only played this game for X amount of time on Steam but I've been playing it for quite some time now through glyph. Every single second I've spend in this game has been awesome, wether it was some simple fishing or killing dangerous monsters, everything has and still is, amazing.If you're new to the game however, feel free to use my referral code: 2TT6-CYQP-ZNNH-RNPN-NFWD"",1"
"10587,Trove,2017.0,""This game is the laggiest thing I have ever played. Not only are controls incredibly delayed, the server side connection is terrible. You hit your hotkey to use a health potion and don't use it until like 2-3 seconds later. The game is very unresponsive, it's like I'm playing on servers located in a whole different region.Also, good luck finding English speakers. Everyone who plays this game speaks Spanish, must be where all the servers are or something.Also, if you like spending tons of money just to be able to have fun, you'll probably like this game. Only a masochist would like it though.Used to be decent, now it's a pile ofâ™¥â™¥â™¥â™¥â™¥ 2/10"",0"
"10588,Trove,2015.0,""Trove is an amazing, awesome game. The mobs that I battle everyday to level up and protect the world from evil shadows of darkness. The graphics are great. Everything is great. Play with your friends, Craft, Build, EXPLORE! AND Trove is so awesome that it's FREE!!!!!"",1"
"10589,Trove,2015.0,""Cannot get enough of this cross of so many games its actually original.Ive spent so much time designing my house its no longer a game..its a DREAM that must happen....inspirational,exceptional and nothing like the others...devs are amazing and obviously work day and night to make this a true masterpiece...."",1"
10590,Trove,2015.0,Trove is a great game to play with your friendand to use 160 bombs to blow up a ton of stuff for no reasonbad part is the people crying about the queue they are trying to fixedit-the queues are getting alot betteredit again-no queues for a long time,1
"10591,Trove,2016.0,""This is a great game, and while it can be somewhat P2W at times, it IS possible to succeed in this free game without paying 2 win.  You're definitely not going to get max mastery without P2W, but there are also other ways of having fun in the game.  And besides, who needs 300 party animals anywaysXD.There are 16 classes right now, and a bunch of them are ones I use regularly.  I use neon ninja to farm adventurre worlds, and gunslinger to farm sts and speed run mainly.  Then, if needed I can use Ice Sage to tank dreadnaught, and if needed I can use rev to tank pinata god.  The best class to start out with it either boomer or lunar lancer or candy barb, and then when you get to 5k pr and have a class gem key switch everything over to shadow hunter and wreck every adventure world.  Or, you could be like me and start out with ice sage, like the worst class to start out withXD.Overall it's a great game, but if it lost the lag it would be even better.One other thing is you can build tons of stuff in trove and you can check out lots of clubworlds to see what other people built.  Some clubs have some fantastic mag rail music tracks, and others have some pretty awesome mazes and creations.  There's lots of pixel art to see too, as well as some pretty cool castles."",1"
"10592,Trove,2015.0,""Hello People... First of all it was long time ago since i made a review but ill try to keep it simple for the info that i got so far and Im a Newbie my self in the game i have played for 35 hours and some information might be incorrect and im not even near end game! ^^.At the first ppl look at the game... oh sh... its a copy of minecraft... well ITS NOT.The game is basicly allowing you to make a house where you can have your personal stuff like loot and you can spawn your house at worlds with you... you can costumize your own building how ever you want and have working bench and portals and other crafting benches... the house is personal and people can join you and have fun...What you can do in this game with friends is Going out and Farm monsters and do these Dungeons that is everywhere in the map and gain awesome loot with amazing stats in it. i would say its more like Diablo 3 farming style. you run around in dungeons and get loot and you can share items with others... the loot system is personal but if you find something nice you could take the loot and drop it to a friend if you want to :) and the loot that you get and dont need you turn them into materials for crafting. well i dont really know how to explain it better than this... i would say hey... give it a try and dont read comments like this and just jump into the game and give it a go  :) The bad thing is atm the Que Timer, but i hope they fix it really soon... its about 1-60 mins long, some times its really not showing the right time and if it says MORE than 60 mins its just lying to you... so dont trust that it can really jump and just lie that its 300 mins in que. just be patient and youll get in to the game. if you havent played TRION WORLDS game and need an account why not take my link to Recruit a friend link for the game its on my Steam page soon.AND THE GAME IS FREE GUYS! and NOT a pay to win game. just go for it!and i hope you guys understood any of what i just have written above, english is my third language and i hope you enjoyed my review and thanks for taking the time to read it! and write in comments if theres something incorrect what i wrote about the content of the game!"",1"
"10593,Trove,2017.0,""Once upon a time this was a great game. An MMO with creativity and fun mechanics. With each expansion however the game eventually revealed its treachery as a P2W money-making scam. The development team continued to add features and pay walls to limit the new player base and increase the amount of money you needed to spend to progress. The game no longer feels lighthearted and fun, but grindy and boring. AVOID THIS GAME, IT WILL CAUSE YOU ONLY HEARTBREAK."",0"
"10594,Trove,2016.0,""This game used to be fun. until they went too far with the microtransactions and basically went from customizeables and occasional pay to win, to full pay to win. everything that used to cost ingame currency, like new classes, have been thrown out the window for real cash only. I have stopped playing this game because its not the game i was interested in when i first played. it used to be a sort of childish fun with a cool rpg feel to it. Dragons were farmed for days, but no. they created eggs which i have to either fork money over for or spend months trying to earn one. Next problem the devs created, which i would go back if this got scrapped, is gems. it made no sense to me to add these in and the game would've been perfect if it stayed the way it was in november - mid december. i would not recommend this game to NEW PLAYERS, but to retturning players, i say play with the changes and see how you feel about the changes."",0"
"10595,Trove,2018.0,""The game is repetitive, grindy and pay to win. The game itself is childish and so are most of the people that play it, you can tell just from the reviews of this game that most of the people that play it are below the age of 12 and thats why the game is rated as """"Mostly positive."""""",0"
"10596,Trove,2015.0,""If you do not like grinding games this is definetly not one for you!that being said if you like to collect items and different cosmetic styles this is definetly a game for you.They have recently added PvP Beta and Shadow Towers (like small Raids), and the game keeps updating.Altough i think the game is great no game is without their own problems, server downtime is one of those, but (and this is a big but) the servers are getting more stable every patch! The game has come a long way since last i played it and i have gotten hooked on it again, altough i can get random crashes for no reason the game is fast to restart (annoying yes but dosent matter that much), but aslong as you send reports the issues will be fixed eventually!You can also build like in minecraft and make music and so on, there exist alot of clubs to just hang around in and explore what others have built.All in all this is a great game!"",1"
10597,Trove,2018.0,this game is just awesome the best mmo i've everyplayed so much things to do great community  had and still having alot of fun on this game its just fills my free time .however with all of these good sides the game have some extreme lag  and memory leaks i like the direction that this game is going for with those big updates. I hope for less lag and better optimazation for a better gaming expierence.,1
