review_id,title,year,user_review,user_suggestion
"10656,Trove,2016.0,""Pretty decent game. I've only played the game for 12 hours and I could say that it's something worth to check out! Easpically since it's free to play. Sometimes it gets over reptitive, to get more power rank you need to complete dungeons or castles and open up the chests after you kill the boss/s. This is mainly what the game consists off. So sometimes it may become boring. Otherwise the game is perfect! I've played with friends and i've got to tell you that it's much more fun with friends. It's fun to grind the game, it's like a kids version of Neverwinter. The cornorstones spawn in great places and your cornorstone saves by itself! You can fight random mobs while free roaming, and once in a while a miniture boss spawns near you. So with my overall expierence, I would definitely rate this game a 8.5/10."",1"
10657,Trove,2016.0,major memory leak problem with trove 60fps will drop to 15fps on a 970gtx and multi gpu i've tested. trion won't do anything to fix this problem .. they just want you to buy more credits and don't care to fix anything.,0
"10658,Trove,2016.0,""When you have 2.1k hours nearly $1,000 USD spent on a game youd assume when an issue prevents you from logging in the support team would handle it quickly, its been 2 weeks since my support ticket has been open and its still not resloved. Trion is known for their poor support system now I know first hand"",0"
"10659,Trove,2016.0,""Dont get fooled by the reviews saying 'this game is pay to win' or 'this game is cancer' because to be honest i was actually surprised by how good this game was. This is one of those games where you either love it or you hate, personally i love it. Having a good world, a good overall atmosphere and fun classes. The only bad thing i found is that you do have to grind alot in the game, but that wasn't too much of a problem for me. For a free game, it is very good, i would rate this a 7/10 "",1"
"10660,Trove,2018.0,""- I have a couple 100 hours on the non-steam version of this game -GAMEPLAYThis game has a handful of things to do, but it mainly comes down to"
"10661,Trove,2017.0,"" It's basically  """"Grind Some More""""  - THE GAME. No story, naration or plot. P2W elements are present. However, it does have some things going well for it. +Interesting and various Classes+Wide Variety of Dungeons+Tons upon tons of Collectibles: Mounts, """"Pets"""", Boats, Wings, Gear Appearances, Weapon Appearances +Crafting, Upgrades+And in case you're wondering, no, it has nothing to do with Minecraft Unfortunately, it's  repetative  . The only goal in this game is to grind up until you max everything out (if possible), so you can grind (even more) at a slightly faster pace. It's PvE. PvP is bad and unsatisfying.And as mentioned, it IS Pay-To-Win, even though you can earn everything through, guess what - grinding. Even the currency, purchased with real money, can be obtained through playing, it just takes a LOT of time.It takes some dedication to continue playing after a certain level, as there are difficulty spikes, quite possibly to make you buy upgrades on their store in order to move on, but everything is doeable, especially if you group up with a friend or two. The reason why I'd recommend Trove is because it's Free To Play, there is constant progression and tons of collectibles, plus it's appealing to gamers who fancy their grindy-looty games.  After a long day, I find myself logging on for a few dungeons and destroying some pixels. All in all, I've had a good time. "",1"
"10662,Trove,2015.0,""I downloaded this game 13 hours ago. I have 11 hours on this game at the time of writing this review. I think I have my new addiction. It is totally worth playing, especially as it's free. Although I did have to wait a while to log on to start with, the wait was definitely worth it.Cubeworld 2.0Tis fancy."",1"
"10663,Trove,2018.0,""ProsThis is a really really great game, if you've played cube world before then you will absolutely love this game. There are so many things to do, you can build, make decorations grind for exp and more. The graphics are also pretty good for games like this, simple and nice to see. It's very grindy but still fun, since you're not just farming monsters, but also go around mining and crafting, there is also minigame every 1 hour.ConsThere is almost no con in the gameplay itself for me, but the very sad thing is the performance of this game. I have a good connection and currently stable ping, but when i play i get thrown back here and there (teleported cause of lag). This is very annoying especially when playing the minigame where you have to collect a lot of coins within the time limit, and sometimes you just get confused where you're right now. Not just that, the world rendering is very slow too, especially if you go to places with no player, you have to wait for the world to render, and walk again and wait again, this is very annoying.I can't recommend this game cause the good gameplay just makes you want to play more but the bad performance makes you hate it more, leaving you with the feeling of wanting to play but can't."",0"
"10664,Trove,2018.0,""Great game with potato server, and max 20 players in each map, so if you are the 21st player you will be moved to a new created map (new server, potato free server even with 20 players still lag). You play so lonely just like single player offline game, the only thing that makes you realize that you are playing online is the lag : everytime you walk you have to be stopped, can't move and wait till  the map rendering."",0"
"10665,Trove,2017.0,""This game is one of best free games that I played.The community is nice and can be social,what u know by experience for this game is that it's going to take you a long time to master every class personally I will go for candy barb he is a great starter class and the whole gem system can get u really strong very quickly if u grind and do a lot of dungeons for hours and also I recommend watching twitch live streams bc the twitch streamers give out free stuff like wings and rareâ™¥â™¥â™¥â™¥â™¥â™¥like that , and the trade system is huge so if ur looking for something u will have to find someone or either buy it, the game is a huge adventure honestly"",1"
"10666,Trove,2018.0,""I enjoyed putting many of my hours into farming and gearing up my character. However, most of that enjoyment did not originate from the actual content of the game, but rather from playing and talking with all the great people i have met. Being an officer in my main club was a great experience and I even play other games now still with my friends found in trove. Once my club died, I saw that Trove had merely been a medium for me to play with those people. The gameplay is dull and monotone, developers hardly put any work into new content (atleast it feels like that to me) and the pay-to-win aspect of the cash shop has influenced the market so much that my once wealthy account's cash is now worth a few scraps. I stopped playing this game about half a year back (or more, dont remember) and everytime I log back in just to see what has changed, I am horrified by all the new """"content"""" that has been added (mostly just reskins and cash shop stuff)So yes, I think this game should'nt be as popular as it is, and yes, I am giving it a bad review, BUT...I actually do encourage you to pick up this game! I know i am sounding like a hypocrit, but the playerbase and community that revolves around this game is utterly filled with amazing people. I enjoyed this game a lot!Game: 4/10 (please make your game great again Trion)Community: 10/10 , would try and find a club again (if the game is fixed "
"10667,Trove,2017.0,""nice gameinvolve a lot of farming ressources and grinding kills...for the sake of completion and advancement, one must collect and craft a ton of thingsalso builders can happily create near to anything from styles to dungeons"",1"
10668,Trove,2015.0,Trove is a free to play voxel world MMO with a ton to offer.-Exceptional combat-Great character customization including skins for all equipables-Very polished graphics and UI for a Voxel title-Great / friendly community-Rewarding crafting and resource gatheringOverall 8/10 Biggest downfall being new launch title servers which are being worked on.,1
"10669,Trove,2016.0,""I recommend this game  because it is really fun, and doesn't frequently frustrate me beyond limits. Favourite feature:  like how you can bring your house with you, anywhere you go, instead of running a mile away from your house and then having to backtrace and maybe even lose it. You can really explore beyond limits on this game!Least favourite feature: This may just be my friend's and my opinion, but... I think that some items are asking for too much materials to be crafted, or too rare materials. I suppose it will keep you searching and exploring. Maybe this isn't a bad feature for some but sometimes I just give up on trying to find items!I rate this 8/10Very good and addictive. Fun to play with friends and to compete for better items, houses and much more!"",1"
"10670,Trove,2018.0,""Small review from a newbiePretty alright game, and I'll get to my little review on it - starting with the cons. Cons: (Optimization/Microtransactions)The main issue's the horrible optimization of the servers, including how it's pretty difficult to get through the early stages by playing freely.(Simply put, it's a game where they'll probably try to milk you for all you have, unless you get very lucky with the RNG)A couple bugs here and there - all being somewhat annoying, but not the worst thing out there. Pros: (Community/Map/Building)Helpful community, pretty funny at times.  Fun map to explore, but it can be tedious to travel around so much - not even being able to teleport back to your cornerstone.. (This one's a con, and a pro - depends on how you like to play)Freely building on/in your cornerstone is a nice feature, along with the items you can later get to upgrade the appearance of it. Lots of freedom to build whatever you'd like, in all honesty. Feel free to give it a try, I'd recommend it. "",1"
10671,Trove,2018.0,The game itself is one of the best iv'e seen so far. the game is open based so you can go around with friends and slay monsters for some sweat loot. though i do have one small problem is that you have trials for some charecters to play as. but all and all its 9 outta 10 for me,1
"10672,Trove,2016.0,""I may be a little biased here, but Trove wasn't a great experience for me.Now, I'm not saying don't get it (mostly because it's free ((for now.)) ) But when I played it for an idle two hours, I got bored fairly quickly. Sure, the worlds are pretty, and I like the 3D cube style along the likes of Minecraft. But the gameplay is repetitive. In my brief session, I rocketed up to the highest level rank, and it wasn't even that different. I felt no motiviation to upgrade my house or tools, or even try out other classes. Also, the building blocks are really uninspired. All they have are 'color' primal blocks and ores. At least, that's all I found naturally. Mining was tedious, dying was easy, and the combat wasn't polished.Hey, maybe it updated and got better since I played, and hey, maybe some people like this tedious adventure. But as for me, I don't think I'll pick it up again.4.5/10 would not dig again"",0"
10673,Trove,2016.0,I got the game quite a while ago when it was actually FUN now its just like another EA gameHow to Play EA Games-Buy game -Buy character-Buy gun-Buy addon to work-buy seasonal pass-Buy Maps-Buy Game time-Buy character customization-Buy account-Buy good weapons-Buy some other s*** that you need-Try to not cry about your wasted money while you play a terrible gamewith no updates or exciting gameplay or any value of your time10 out of 10 would roast again,0
"10674,Trove,2018.0,""At first, it doesnt seem so bad. Movement is fun, combat is fun. When you get to the open world stuff, thats when ths game drops the ball. Its full of microtransactions, confusing, and hard to play. Eventually, the game itself stops loaing up after 1 play session."",0"
"10675,Trove,2017.0,""Lmao, ignore these reviewers.(Im from beta, the non-steam version. Ignore my hours.)IS IT PAY TO WIN?-Theres not even a win, honestly. -No level lock. (Max level is 20, and then whatever your gear is forged to.)-No classes you can't have.(You can craft then with rare recorces, half of them very easiliy. Time consuming, but you could get the supplies in a day if you really wanted. Plus frankly, if you join a club people often will help you out assuming you can make friends.)-Patreon status only gives small bonuses, like 50% more EXP, 2 more max HP flasks, craft faster. Etc. (You can also get patreon 1-3 day passes by rare chance in chests)-A lot of the smaller things you can buy you can loot from chests.No, its not pay to win. Unless you consider a few mounts """"winning"""".Shut up and play it, its free."",1"
"10676,Trove,2015.0,""This game is a blocky 3d aventuring game a bit like Minecraft, but with a bit less to do. Don't get me wrong, there is still a LOT to do tho. It's a simple game, which is nice for casual players. Edit: Queues are mostly gone, you can get in very easily now!"",1"
"10677,Trove,2016.0,""Ok, so for the past few games, ive been logging onto Trove only to find out i cant click anything. That being said, I cant craft anything, have to force exit the game, and cannot join my friends parties. On top of that, the camera glitches so bad. (I'll be running somewhere and suddenly the camera will turn around). Has this happened to anyone and/or how do I fix this problem? Because I really like Trove but with these problems I'm getting sort of annoyed to the point I dont want to play anymore.I used to play this game no problem. And not pay for ANYTHING... I would just grind to get what I needed. Now you're telling me I need to put my life savings into this game? Why? "",0"
"10678,Trove,2016.0,""What has happend to you my child, Once a beautiful thing full of life. Creating smiles and joy all around. Now you create heart ache and depression hurting those you loved and cared for with Pay to win."",0"
"10679,Trove,2016.0,""Real talk here, this game was a fun time waster. Though it got grindy, and they shoved paid mounts and """"totally radical"""" costumes in yer face, I liked it. I got level 20 candy barb, got a gummy bear costume, gave away some stuff with my money. Then I quit.Reviews started talking about the new update, then I just took it in. Then I made MS paint comics on the issue. Namely, the updates that force you to throw money at them. They removed permanent stat boosts in favour of expendable money. I will never come back.""""Bury me with my gold.""""-famous last words of Sir Trion"",0"
"10680,Trove,2018.0,""this game so addictive, I like itgood to play with your friend....but too much grinding, its not good for my poor brain and body :(. and lack of side mission and hard to find something to do beside beat dungeon or mining like mad man.server only alvalable in EU, NA and PTS-US. its a bit laggy and delay in my country, make its hard to play... "",0"
"10681,Trove,2015.0,""Everything about this game is great. It's play-2-win instead of pay-2-win, there's not too much to buy, the grinding is fun. This game wil drag you in for hours, except one thing. The one flaw with this game is the lag and connectivity issues severely imparing your fun with this game. Although, hopefully this will be fixed soon. 9/10 easy."",1"
"10682,Trove,2016.0,""I really enjoyed this game for it's ability to get anything in the game, minus a few things, with either hard work. Or money. However it is now steering very far into the p2p territory. And it makes me sad."",0"
"10683,Trove,2016.0,""After 1 hours,I finally download it suck game. Yeah,  you wanna me register an account? Yeah,you got it.But, CAPTCHA wasn't come up my insight, and always reminds  me you fit into wrong captcha. Damn, I did't see any captcha at all."",0"
"10684,Trove,2016.0,""I tried, i really did. one of my friends loves this game but i just cant do it. i even tried to play with premium to see if that makes it better, but its just not good. all of the stages are the same thing with just level modification on gear and a completely assanine upgrade system if your not giving them money. didnt even have fun with friends 2/10"",0"
"10685,Trove,2017.0,""I honestly really like this game, which makes me a bit sad to see most of the helpful reviews are the negative ones. I mean yes, the negative reviews are almost always correct with issues like optimization, constant crashes, and a hard difficulty curve and grind one has to do to overcome it. But I would still definitely give this game a recomendation, as this is possibly one of the most fun games I've played in a while.To put it simply, Trove is like if Minecraft and CubeWorld had a child. It has the amazing combat system that CubeWorld had (Albeit, far less unbalanced, as CubeWorld's balancing was borderline unforgiving,) and the creativity perks of Minecraft, with a portable home (Or Cornerstone, as it's called) that can be pretty much anything you set your mind to. And it works amazingly as a game, I've spent countless hours both creating bases and exploring the worlds, fighting monsters.The main gameplay mechanics are dungeon crawling and building your base. Dungeon crawling gives you loot, which can help you get both stronger and more stuff to customize with. There are numerous biomes, all very unique and fun to explore (My personal favorites being Candoria and the Fae Wilds,) and there's even a mining mechanic with different ores and even recipes you can find.There are also numerous classes to play as, with different playstyles and strategies to play around with. They're all very easy to get used to, and very creative in some regards as well. You're limited to picking a limited number as a starter, but as you go along, you'll be able to unlock the others, either by gathering the material, earning class tokens, or if you really want to, buying them with real money.The game also features a chat system you switch between. In fact, it has a chat where literally everyone can see, no matter what world they're on, which is extremely useful for both finding/selling gear, and asking for help or likewise giving help. However, it does have its share of spambots and elitists, but with every positive, there is a negative.And storywise, you won't experience anything in game as of writing that contains a story. The opening cinematic is as much story as I've been able to find, and it makes me sad, since it does have a premise of being interesting. The idea is that the worlds you explored are shattered remains of a once glorious realm, having been broken apart to save the people from the wrath of the Moon Goddess, seeking to destroy the world in envy for her sister, the Sun Goddess, and her creation.However, as much as I love the game, there are some pretty nasty issues to address. One is the extremely unstable nature of the servers. They crash EXTREMELY often, especially on the Dinosaur biomes. If they aren't crashing though, prepare for rubber-banding or delays with lag. The fact the servers are this unstable despite being a game with what I presume to be a steady playbase and income is very upsetting.Two, it is quite pay encouraging in the later game. While it is possible to go with the game without paying, it's VERY slow and grind-filled unless you dish out some cash. It does seem to have gone down a more player-friendly slope recently, especially with the ability to craft classes now, but it's a very long grind.And third, after a while, you may find it simply hard to continue. While the combat is fun and the dungeons are very creative, you'll eventually see it all and find no real encouragement to play. They have added some variant versions of the hourly challenges, and minigames seem to be on their way, so hopefully this may be resolved soon to encourge more people to play longer.Overall, yes, the game has a plethora of problems. But even with it, the game's creativity and addictive nature has left me with hours of enjoyment, and one I would recommend to at least try out."",1"
"10686,Trove,2016.0,""Un bon concept, une bonne rÃ©alisation, un unnivers marrant... Mais 1 ou 2 jours apres avoir jouer vous vous rendrez compte que les 15 donjons que vous avez trouvez son les seuls modÃ¨les qui existe... Car dans Trove la seuls chose qu'il y est dans la carte se sont des donjons sauf qu'il tous tous identiques (15 / 12 types de donjon a peut prÃ¨s)Ducoup trÃ¨s lassant Ã  la fin"",0"
10687,Trove,2016.0,This game is very samey. After the first hour you have seen just about everything it has to offer. The only changes you get are by unlocking new characters and the process is so long and grindy that its just not fun.The crafting aspects arent as in depth as other games like minecraft and the fighting aspects arent in depth as other fighting/rpg games. Its kind of a watered down version of both. ,0
"10688,Trove,2016.0,""lol another 3rd world game from a 5th world game company , trion is all that needs to be said , they will gladly take all the cash you would be willing to toss at them , if something messes up  failure to recieve items ect you are SOL they will just spam you with tickets stating they have looked at the cases and what done is all that can be done """"which is nothing lol"""" after spending 1 grand on archeage and selling the apexs on market for gold , trion coming in and taking all my gold i made off it saying it was obtained ilegaly i wish nothing but the worst for this game company =)  , save  your cash or toss it in a fire you would get more out of it"",0"
10689,Trove,2016.0,Opened the game. This looks cool. Creates character. Walks along path to the cave. Is rekt by skeleton thing. Respawns. Can't find the skeleton thing in cave. Can't find skeleton thing anywhere on floating island. Tries reloading game. Skeleton thing still no where to be seen. Can't do anything else. Times fallen off map or glitched through it: 1000000. Am I missing something?,0
"10690,Trove,2016.0,""Combat is stale.Classes are stale.Customization is alrightRaids are stale.Community is full of kids.Repetitive and unrewarding at high levels (bad combo)Gear rarity is â™¥â™¥â™¥â™¥ed, Common is common, Uncommon is common, Rare is common, Epic is common, Legendary is common, shadow is uncommon, Rainbow is uncommonThe only good thing is the building. "",0"
