review_id,title,year,user_review,user_suggestion
"10812,Trove,2015.0,""This used to be a positive review, but now, it's pretty negative.  It used to be F2P and pay if you want, but the devs have totally changed their minds.  It's now a pay to win scheme.  Pile of bullcrap."",0"
"10813,Trove,2018.0,""I will start by saying that Trove IS a fun, fairly mindless dungeon crawling form of Minecraft that you can relax and take it easy with in the sea of games that takes themselves far too seriously.  The mods that you can get in the Steam workshop can be very handy as well.  These the only positive thing I can say about it.There are six words I have for people out there even curious about this game:  """"Free to play,""""  """"Pay to win.""""  The game's model is heavily based on using its cash shop for virtually everything in the game.  Sure you can """"collect the items naturally"""" in game, but the costs for many of these items are very heavy, to near Exhuberent amounts.  The game's balance in item drops is not cringy in the slightest, it's a nightmarish pit of dispair.  Oh, and for optimal looting perks, you *HAVE* to join their Patreon which they will graciously tease you with from rare one to three day """"free patreon coins"""" to show you how much better your life would be if you subscribe to them.The servers of this game can range in between playable and smooth all the way to you might as well pretend this game doesn't exist for a week or three.  Aside from usual Lag that is the bane of all persons in 90% of all MMO's, the game will spontaniously crash for no clear apparent reason.  From my own experiences, somethng as simple as walking through the map is enough for the game to crash and request and error report, and you aren't even allowed to put a message into the report to explain what you were doing when the crash happened.  Trion Worlds (as a company) """"try"""" to resolve the issue, but never seem to actually acknowledge it is a legitimate problem.Their character balance in the servers isn't too bad, *IF* you stick to player versus AI.  It still has problems as there is this wild swing in between viable characters and near unplayable trash, but the silver lining is they have recently started to adress some of the issues with some of the weaker classes.  If you dare attempt their PVP area, good luck in being half way viable between all the sickening imbalance there is with the Pirate Captain being one the largest problems in the scene.  And of course, as prementioned, if you experience any lag makes the PVP section even more unbalanced.As I said, the game can be fun, however it is a sickening display of promoting itself as """"free to play,"""" but its pay to win aspect makes the game unbearable.A note to make:  Around October, the original makers of this game is a defunct company absorbed by a new one.  While this could be good for the game if the new company pays 1/1000 of attention to it that it deserved that it didn't get from Trion Worlds, do *NOT* hold your breath."",0"
10814,Trove,2016.0,This is a very Awesome game i Recommend it when they add more stuff it does get boring after a while because all you do is build kill upgrade and go to dungeons. So game a 8/10 Great Game Keep it up,1
"10815,Trove,2016.0,""Such a great game but yet so much grinding...So I was one of the first to play trove a while back, SO this game gives me lots of memories. But I won't let that affect my reviewTrove is a Voxel based MMORPG. Its great in some areas but then others not so much. There is a lot of customization to the game which I like, And a great loot system (Everybody gets loot in a specific area). The overall thing I hate about this game is all the grinding. it took me 2 hours just to finish quests and to be honest, they weren't even fun. They made you go to a frost biome to kill 100 dark creature the after you finish that quest you have to kill 200 more of a different harder kind. Overall it is a great game but needs some type of story/mission based gameplay6/10"",1"
"10816,Trove,,""adventerous game, with exploring, cool items, cool mobs and lots more. (Even dragons!) My friend suggested this to me and I waited to get it. Finally, I got it, and I was happy. It's fun, and I'd suggest it to any people that love exploring worlds, fighting and any of that stuff.Tigerdragon64."",1"
"10817,Trove,2018.0,""I would not recommend this game to anyone, it was an okay game 1 year ago, but it has become way too pay to win and a random german company bought off the game, It has only been going downhill since."",0"
10818,Trove,2018.0,well i dont like this game ANYMORE bcs i have seen its changes...from good REASONABLE TIMES NEEdED TO PROGRESS (i miss closed beta) to now utter â™¥â™¥â™¥â™¥â™¥â™¥â™¥t NONESENSICAL TIMEGATES ALL OVER!you should be prepared you need things that are only obtainable once a week. you now MUST login everyday to get monthly rewards worth mastery. the one thing you need to upgrade everything is now worthless garbage and pretty much useless for new content unless you got multiple stacks of it to spare (9999 flux). forging was unneccessarily complicated in beta and since left greatly untouched.gear is way less important since gems were inroduced. 4 pieces of gear vs 9 possible gemsits actually easier to forge gems than it is to forge high tier gearall new dragons are brought by eggs instead of souls. they cost 300 dragon coins and you get up to 4 dragon coins per hour + 1 per day and random in dragon caches. also they made them untradablethe list can go on and oni dont think it will get any better in the next months or yearsbut if you found all this to be excusable then i have one more thingthey needed 3 years to implement the hydrakken and dreadnaught,0
"10819,Trove,2017.0,""Not bad, runs on low specs and pretty stable. Lacks bugs and not the biggest 'ptw'. Recommended for casual gamers/sandbox type gamers who play with friends/socialise.Tags: Adventureous, social, fair play, multiplayer, exciting, bosses, loot, events, etc.Overall pretty good.Rating: 7.8/10"",1"
"10820,Trove,2017.0,""Don't bother. Laggy servers, P2W nature and lots of grinding. I'm not saying that grinding is bad, but with laggy servers, the experience is...enraging. I won't dwell into the P2W nature of the game, since I'm sure everyone knows what it means. Fortunately, there have been announcements stating that server lag will be fixed. But as it stands for now, I STRONGLY do not recommend this game."",0"
"10821,Trove,2018.0,""So first i started playing Trove back in 2014 and i personally really enjoyed it, i'm a man of all kind of games and i assure you if you are into Grinding, and you aren't very effected by repetitivity then i would reccomend it, however if you aren't i would not recommend it, BUT i started trying the game again in 2018 and i really enjoyed it, i hit a thousand hours, and maxed out numerous characters got all the dragons, spend roughly 25$ and i enjoyed the experience.I Recommend."",1"
"10822,Trove,2018.0,""If you think this game is Pay-to-Win then you are most likely wrong, about almost everything in this game is craftable. There is no story at all, and this game is mostly about dungeon hunting but 3d and kinda like minecraft."",1"
"10823,Trove,2018.0,""Despite my hours i have played this game over a few years now and i have occasionally checked in on how its doing. Taking into consideration the devs and their actions also the track this game is heading down it could have been great at what it was designed to do but the devs failed the fans and the fans failed to push the devs. From the beginning there were numerous server issues. A few years ago there was a point when the game was basically unplayable. Also the devs love micro transactions so much they turned this game into the equivelent of a slot machine in las vegas. Micro Transactions can be ok if they come in small quantites but when the game is built on them its a bit exsessive. With the hours of all of me and my friends combined we have close to around 2300 hours. And its safe to say we are all displeased with how the game has turned out. The one shimmering light in the void that is this game is the great community it has. Over the years throughout its popularity and the decline recently the community has be a constant bright spot for the game and one of the best i have experienced, The people may be patient but the devs will be the death of this game."",0"
"10824,Trove,2016.0,""game has been turned to endless grind. i remember that day when full radiant set was the best, when for dragon u needed to complete events every hour where u need complete dungeon in some biome (for that time racings or collection challenges wasn't in game) and then u can get 2-3 chests where can be dropped or dragon coins which u can sell on market for 2k flux, or same dragon's soul, i think this system need some corrects, for exam. to do quests how's weekly events at this moment and for 1 quest completion u get some number of souls. WHY NOT?/?// why i must to farm every day â™¥â™¥â™¥â™¥ing dragon coins and flux, materials. it's too boring. gems are separate story, 70 â™¥â™¥â™¥â™¥ing chests i need to full up karma bar for stellar gem and not 100% chance that this gem will be with 2-3 stars. So i wish u understand me. Why i want to play this game, i like this game, but cos of i dont want to play this game 24/7 i can't be good player which can go to ultra shadow tower with other good skilled players and complete this dotm. One more thing, 2 years ago i've believed that Shadow Hunter will be good character, cos for that time it was bad, i though that glyph will change stats, BUT they are sooooooooooooooooooooooo lazy and can't to invent something and they just do very high attack speed therefore m2 and 2 skills not using (skill on 1 key sometimes can be used). It's all. Sorry for my english (this text i writing with translate google, so...) 3 fae tricksters/10. For that time fae trickster and ice sage were the best."",0"
"10825,Trove,2016.0,""This game is amazing, Its 8bit 3d, but yet its still really good quality. Really hard to explain. 11/10 recommended to play this  game you can't explain how good it is if you love MMORPGS or building a house, This game is 100% recommended me from me. A really good game, with tons of DLC and bonuses. Tons of awesome code giveaway by popular streamers, and tons more epic stuff. I recommend playing this game and here is a free code as a thanks for reading. redeem website: adf . ly/1caQwo"",1"
"10826,Trove,2016.0,""One of my favorite steam games to play as of right now. This game brings me back to when Lego Universe existed, and it has a very similar feeling to it. Lots of classes, fair play, some minor tweaking needed here and there, but overall, great game."",1"
10827,Trove,2018.0,Trove is an alright game for those who like to grind it takes about 300 hours for a F2P player to accually get anywhere near close to powerful. Servers can be a mess and break often but the community seems to be stable. Game is fairly well constructed with the expection of P2W factor that has let down the community. Overall its a Meh Game.,1
"10828,Trove,2016.0,""Another instance of Trion moneygrubbing the community. When this came to steam, I got as many friends as I could to play(Not because I tried it yet, but because the concept was enticing). We grinded up to max by doing as much as we could, got a few of the other classes, and all around was just having a good time. We stopped playing and a few months ago (when dragons came out), I gave the game a look and found that I could simply buy a dragon and not have to do the -extensive- grinding. I quit after wasting much time attempting to grind the mats.Then, recently, I looked over the game again"
"10829,Trove,2016.0,""Hi, I been playing this game for 3 year now. The game was created in 2013. So far they only add useless mount and no new account. The developer does not care about the game. Every patch the game get bugy and unplayable. Today mostly everything is untradeable. This game will become a singleplayer. The developer does not care about the game and does not listen to player. They only care about money and how to milk new player with dead content. If you like sandbox game play minecraft it better and consistent. Trove is not a MMO... it a useless game... TRION as a hole does not care about games."",0"
"10830,Trove,,""dont really know whether i should recommend this game or not cause it has big potential but the developer misstreated it, you need money to unlock certain stuff (not pay to win though) and its really hard to get in. Getting good equipment dropped (no matter if the stats are the ones you need) take longer than just buying what you want from better player. It also dont get many updates. Id love to love this game but i cant"",0"
"10831,Trove,2018.0,""This game is fairly fantastic. The world is big and put together very well for an MMO.  It's a dungeon crawler mixed with 3D graphics and sandbox.  The only things I have truly against it are that it has a section that is pretry strong pay to win, and the fact that many of the classes are built to be played in a group. So if you play this then be sure to invite a friend to play with so you can enjoy it a whole lot longer and better."",1"
"10832,Trove,2018.0,""With almost 300 hours on this game, and my first ever Steam review. I can firmly say that this game is absolutely fun to play, however, unless you're willing to put much of your free time into this game, you won't go far. It's not a game for people who just want to pick this game up and play it. You need to invest time ( or money : Will talk about this in a bit ). With almost 300 hours, although I have almost all the playable unlockables ( ever class unlocked excluding Vanguardian ) and many cosmetics ( Mastery 298 - you gain these mastery points from cosmetics and leveling up ) I am nowhere near """"end game"""" for an MMORPG - Although I have access to all the content, I just cannot deal enough damage to be invited to late game runs. A, because I don't have time to grind CONSTANTLY, and B, I don't spend enough money. You can get anything in this game over time, without spending money, however it's tedious because getting better is much on RNG without spending a ton of money.Gameplay wise, this game is really nice 6/10, however if you don't want to spend more than $50 on this game, it would bring you almost no fun without 300+ hours4/10 overall."",0"
"10833,Trove,2017.0,""NEW PART  5109 HOURS IN  NEW LVL OF BS BY DEVS BEWAREhello I just noticed 73mill of my legit megaflux tanks I got went missing with the other 300mill """"none legit"""" ones I had in a club chest I have no issue taking back allll the none legit from ppl but â™¥â™¥â™¥â™¥ing over ppl and taking there legitâ™¥â™¥â™¥â™¥â™¥â™¥is bs look in my history and look at the flux build up in the officer chest in the club named """" Guild of Merchants """" officer chest flux was legit and the reg club chest wasn't reason why I kept em separate so u guys could tell what ones legit or not wen u guys clean it please return my legit 7300 mega tank stack ive been selling a lot of my items for for last 7monthsSenior GM Garth Today at 21:12Hello,Thank you for contacting us regarding Trove.We understand that your account was affected during the cleanups that occurred after the duplication issue on Trove PC. Unfortunately, your account was found to have gained significant duplicated flux. Due to this, we will be unable to restore progress that was lost in the clean up time frame. While we will be unable to roll your account back or provide the items back to your character, we have granted compensation to all accounts that were affected by these issues or the downtime that was a result of our effort to get the marketplace back where it was before this occurred. All marketplace transactions should have been reversed and the items sold should be back in your inventory for you. As the flux that was received originally was not legitimate, we will be unable to provide the amount of flux to your account that the item sold for on the marketplace.In order to correct the economic issue, we removed items that were obtained after the duplication took place and before the servers were taken down. If you made a monetary, credit, or cubit purchase during this time-frame and had its contents removed that was not our intent. Please update this ticket with information about what was purchased and when it occurred and we will look into refunding or restoring the purchase(s) back to your account.We do appreciate your patience in this matter and sincerely apologize for the inconvenience that this issue has caused. If you would like to review the compensation that was granted, please follow the below link:http://forums.trovegame.com/showthread.php?135956If you have any additional questions or concerns, please don't hesitate to let us know. Thank you for your continued support of Trion Worlds and for playing Trove.Your reference number for this ticket is (MHM NOT GETTING MY INFO)Sincerely,Senior GM GarthTrion Worlds Incso basically they just generically copy pasted some bs didnt check the logs didnt actaully read any of it and im out 73mill flux what was legit what can easily be checked if they looked a few days back this coulda been all avoided if they LISTENED TO THE â™¥â™¥â™¥â™¥ING COMMUNITY WHEN EVERYONE SAID ROLL BACK BUTTTT NOOOOO TRION SAID WE WILL DO MANAUL """"FIX IT""""  like haaa trion cant fixâ™¥â™¥â™¥â™¥â™¥â™¥so gg 73mill and any money me and friends woulda spent on trove also devs should be carefull on how â™¥â™¥â™¥â™¥â™¥â™¥â™¥â™¥ they be ppl can get to new lvl ofâ™¥â™¥â™¥â™¥â™¥â™¥â™¥â™¥well since ive played well past 2600 hours now and been here since day 1 of the game with the 5k ppl infront of you  times when things weren't money hungry and cancerous,   the game has been getting worse and worse each update they introduce due to making more items untradable under your nose too adding new game breaking or nightmareish system updates    they became so money hungry you cannot trade items u buy from the store with irl money anymore nor can u resell credit pouches (pouches u buy 2 sell to players for flux)  so once u buy it for yourself a merch or by mistake it automatically consume this item and you will be forced to buy an untradable item u may not want or cannot sell  take example  back in the day you could buy something in the store by accident with irl or credits and then realize u misclicked (happens wen your awake late at night half asleep)  and you where like meh i can just resell it for my money back no harm done,  no but now if you do this your 100% screwed you will be stuck with it  and another thing is there events wen they make there events they have game breaking drop rates or side effects that can effect the entire game, wealth, player base for months  since early 2016 its been going down hill it really got hit hard end of 2016   most items are untradable at this point instead of making more things tradable so new players can actaully make money,    im one of the very few very rich players with over 300million flux  i have met over 500 players less then 100k flux and 100 under 10k flux they simply cannot make enough flux to play and end up struggling to progress or get anything they wanted or needed  over all thoughPROS:errrrrrrrrrrrr """"it's free?""""CONS:more and more untradablesless ways to make money ingamemostly toxic or begger player baseyou will need your wallet and 9 more lifesthe servers are EXTREMELY laggy and rubberbandy i just stay in my vault worlds and not moveand i got a 3k computer that can play the newest best games on max everything with 200-300 fps (arma 3 as a example)the trion staff are clueless and are money hungrythe updates always got a hidden update (means very bad voodoo things).....................................................................................................................all i can think of at the moment...save yourself  or yolo in   i personally would not play if i just started playing the game nowif you do wish to play this game you can add or contact me on steam or my profile im willing to help and give advice on what to do to get started in money making"",0"
